{
  "schema_version": "1.0",
  "contract": "saas-creative-director/figma-manifest",
  "project": {
    "id": "ledgerly-fictional-example",
    "name": "Ledgerly (fictional example)"
  },
  "source_revision": "storyboard-e08d58c9bd3d",
  "document_pages": [
    "01 Research",
    "02 Creative Directions",
    "03 Visual Grammar",
    "04 Storyboard",
    "05 Production Frames",
    "06 Handoff"
  ],
  "target_page": "04 Storyboard",
  "canvas": {
    "width": 1920.0,
    "height": 1080.0,
    "scene_gap": 160,
    "annotation_width": 480,
    "annotation_gap": 32
  },
  "typography": {
    "family": "Inter",
    "style": "Regular",
    "fallbacks": [
      "Inter",
      "Roboto"
    ]
  },
  "tokens": {
    "colors": {
      "canvas": "#F9FAFB",
      "surface": "#F9FAFB",
      "raised": "#FFFFFF",
      "muted": "#F3F4F6",
      "dark": "#111827",
      "accent": "#4F46E5",
      "accent_surface": "#EEF2FF",
      "success": "#ECFDF5",
      "warning": "#FFF7ED",
      "raster": "#FFF1F2",
      "border": "#D1D5DB",
      "text_primary": "#111827",
      "text_secondary": "#4B5563",
      "text_on_accent": "#FFFFFF"
    },
    "spacing": {
      "base": 8,
      "corner_radius": 18,
      "stroke_width": 2
    },
    "type_scale": {
      "headline": 56,
      "title": 30,
      "body": 18,
      "eyebrow": 15
    }
  },
  "recipes": [
    "source-convergence",
    "horizontal-flow",
    "focus-detail"
  ],
  "limits": {
    "max_manifest_bytes": 2000000,
    "max_scenes": 48,
    "max_nodes": 2500,
    "max_nodes_per_scene": 200,
    "max_text_chars": 4000,
    "max_total_text_chars": 100000,
    "max_canvas_dimension": 8192,
    "max_pages": 12
  },
  "scenes": [
    {
      "semantic_id": "scene/S01",
      "id": "S01",
      "name": "S01 — Establish fragmented inputs",
      "source_revision": "scene-d31c2416b6eaae4c",
      "content_hash": "d31c2416b6eaae4c",
      "duration_seconds": 7,
      "composition_pattern": "C01 multi-source",
      "pattern_version": "legacy-0.5",
      "recipe": "source-convergence",
      "recipe_version": "1.0",
      "recipe_selection": "legacy-inferred",
      "nodes": [
        {
          "semantic_id": "S01/copy/headline",
          "type": "text",
          "role": "copy",
          "name": "10_COPY_HEADLINE",
          "bounds": {
            "x": 96,
            "y": 84,
            "width": 920,
            "height": 132
          },
          "style": "headline",
          "text": "Every source. One reconciliation flow."
        },
        {
          "semantic_id": "S01/convergence/hub",
          "type": "ui-card",
          "role": "primary",
          "name": "20_UI_CONVERGENCE_HUB",
          "bounds": {
            "x": 1200.0,
            "y": 350,
            "width": 560,
            "height": 360
          },
          "style": "accent-surface",
          "children": [
            {
              "semantic_id": "S01/convergence/hub/title",
              "type": "text",
              "role": "label",
              "name": "21_HUB_TITLE",
              "bounds": {
                "x": 40,
                "y": 36,
                "width": 360,
                "height": 48
              },
              "style": "title",
              "text": "Source cards"
            },
            {
              "semantic_id": "S01/convergence/hub/row/01",
              "type": "ui-row",
              "role": "state",
              "name": "22_READY_ROW_01",
              "bounds": {
                "x": 40,
                "y": 124,
                "width": 480,
                "height": 56
              },
              "style": "success",
              "text": "Record 01 · ready"
            },
            {
              "semantic_id": "S01/convergence/hub/row/02",
              "type": "ui-row",
              "role": "state",
              "name": "23_READY_ROW_02",
              "bounds": {
                "x": 40,
                "y": 196,
                "width": 480,
                "height": 56
              },
              "style": "success",
              "text": "Record 02 · ready"
            },
            {
              "semantic_id": "S01/convergence/hub/status",
              "type": "pill",
              "role": "state",
              "name": "24_STATUS",
              "bounds": {
                "x": 40,
                "y": 276,
                "width": 152,
                "height": 36
              },
              "style": "accent",
              "text": "READY"
            }
          ]
        },
        {
          "semantic_id": "S01/convergence/source/01",
          "type": "ui-card",
          "role": "source",
          "name": "20_SOURCE_CARD_01",
          "bounds": {
            "x": 96.0,
            "y": 310.0,
            "width": 320.0,
            "height": 132.0
          },
          "style": "raised",
          "children": [
            {
              "semantic_id": "S01/convergence/source/01/badge",
              "type": "pill",
              "role": "label",
              "name": "21_SOURCE_BADGE_01",
              "bounds": {
                "x": 24,
                "y": 22,
                "width": 80,
                "height": 28
              },
              "style": "muted",
              "text": "SOURCE 1"
            },
            {
              "semantic_id": "S01/convergence/source/01/value",
              "type": "text",
              "role": "value",
              "name": "22_SOURCE_VALUE_01",
              "bounds": {
                "x": 24,
                "y": 66,
                "width": 248,
                "height": 38
              },
              "style": "body",
              "text": "Input channel 1"
            }
          ]
        },
        {
          "semantic_id": "S01/convergence/connector/01",
          "type": "connector",
          "role": "flow",
          "name": "30_FLOW_CONNECTOR_01",
          "bounds": {
            "x": 416.0,
            "y": 376.0,
            "width": 784.0,
            "height": 1
          },
          "style": "accent"
        },
        {
          "semantic_id": "S01/convergence/source/02",
          "type": "ui-card",
          "role": "source",
          "name": "20_SOURCE_CARD_02",
          "bounds": {
            "x": 160.0,
            "y": 500.0,
            "width": 320.0,
            "height": 132.0
          },
          "style": "raised",
          "children": [
            {
              "semantic_id": "S01/convergence/source/02/badge",
              "type": "pill",
              "role": "label",
              "name": "21_SOURCE_BADGE_02",
              "bounds": {
                "x": 24,
                "y": 22,
                "width": 80,
                "height": 28
              },
              "style": "muted",
              "text": "SOURCE 2"
            },
            {
              "semantic_id": "S01/convergence/source/02/value",
              "type": "text",
              "role": "value",
              "name": "22_SOURCE_VALUE_02",
              "bounds": {
                "x": 24,
                "y": 66,
                "width": 248,
                "height": 38
              },
              "style": "body",
              "text": "Input channel 2"
            }
          ]
        },
        {
          "semantic_id": "S01/convergence/connector/02",
          "type": "connector",
          "role": "flow",
          "name": "30_FLOW_CONNECTOR_02",
          "bounds": {
            "x": 480.0,
            "y": 566.0,
            "width": 720.0,
            "height": 1
          },
          "style": "accent"
        },
        {
          "semantic_id": "S01/convergence/source/03",
          "type": "ui-card",
          "role": "source",
          "name": "20_SOURCE_CARD_03",
          "bounds": {
            "x": 96.0,
            "y": 690.0,
            "width": 320.0,
            "height": 132.0
          },
          "style": "raised",
          "children": [
            {
              "semantic_id": "S01/convergence/source/03/badge",
              "type": "pill",
              "role": "label",
              "name": "21_SOURCE_BADGE_03",
              "bounds": {
                "x": 24,
                "y": 22,
                "width": 80,
                "height": 28
              },
              "style": "muted",
              "text": "SOURCE 3"
            },
            {
              "semantic_id": "S01/convergence/source/03/value",
              "type": "text",
              "role": "value",
              "name": "22_SOURCE_VALUE_03",
              "bounds": {
                "x": 24,
                "y": 66,
                "width": 248,
                "height": 38
              },
              "style": "body",
              "text": "Input channel 3"
            }
          ]
        },
        {
          "semantic_id": "S01/convergence/connector/03",
          "type": "connector",
          "role": "flow",
          "name": "30_FLOW_CONNECTOR_03",
          "bounds": {
            "x": 416.0,
            "y": 756.0,
            "width": 784.0,
            "height": 1
          },
          "style": "accent"
        }
      ],
      "states": [],
      "events": [],
      "transition_anchors": [],
      "production_semantics": {
        "objects": [
          {
            "semantic_id": "S01/object/01",
            "name": "Source cards",
            "type": "cards",
            "role": "primary",
            "bounds": {
              "x": 240.0,
              "y": 300.0,
              "width": 1440.0,
              "height": 420.0
            },
            "asset_id": null,
            "editable": true
          }
        ]
      },
      "annotations": {
        "purpose": "Establish fragmented inputs",
        "message": "Payout data arrives from multiple sources.",
        "voiceover": "Payout data arrives from everywhere.",
        "on_screen_copy": "Every source. One reconciliation flow.",